{
  "id": "saas.auth.reset-password",
  "route": "/reset-password/",
  "demoId": "saas",
  "starter": true,
  "translationKey": "saas.auth.reset-password",
  "source": "src/pages/saas/auth/reset-password/page.pug",
  "data": "src/content/locales/en.cjs",
  "styles": ["src/pages/saas/auth/auth.scss"],
  "layout": "auth",
  "theme": "default",
  "locale": "en",
  "direction": "ltr",
  "title": "Reset your password — Orbit",
  "description": "A static Orbit password recovery screen for reviewing the product flow.",
  "head": { "canonical": "self", "openGraphType": "website" },
  "robots": "noindex,follow"
}
